{
  "schemaVersion": "phase01-local-chrome-runtime-v1",
  "generatedAt": "2026-08-30T22:28:46.531Z",
  "status": "PASS",
  "diagnostic": null,
  "run": {
    "id": "LOGIN-SMOKE-V1-local-google-chrome-1440x900",
    "count": 1,
    "command": {
      "version": {
        "executable": "/Applications/Google Chrome.app/Contents/MacOS/Google Chrome",
        "argv": [
          "--version"
        ],
        "shell": false
      },
      "playwright": {
        "package": "@playwright/test",
        "api": "chromium.launch",
        "executable": "/Applications/Google Chrome.app/Contents/MacOS/Google Chrome",
        "project": "local-google-chrome",
        "shell": false
      }
    },
    "runtime": {
      "path": "/Applications/Google Chrome.app/Contents/MacOS/Google Chrome",
      "canonicalPath": "/Applications/Google Chrome.app/Contents/MacOS/Google Chrome",
      "fileType": "regular",
      "executable": true,
      "brand": "Google Chrome",
      "fullVersion": "151.0.7922.174",
      "major": 151,
      "playwrightVersion": "151.0.7922.174",
      "viewport": {
        "width": 1440,
        "height": 900
      },
      "launch": {
        "attempted": true,
        "succeeded": true,
        "headless": true,
        "closed": true
      }
    },
    "scenario": {
      "subject": {
        "manifestPath": ".planning/phases/01-engineering-verification-foundation/EVIDENCE/tested-inputs.json",
        "manifestDigest": "5380d59434c456cf1b8ab35e2485b5b75fcfbae8ef12720f2644f136119763b6",
        "testedSubjectDigest": "9fcb0d747c9b2123212be7b1e5d812c9dff8568db6ea0cb0234549d44afa0e54",
        "health": {
          "scenario_id": "LOGIN-SMOKE-V1",
          "subject_manifest_digest": "5380d59434c456cf1b8ab35e2485b5b75fcfbae8ef12720f2644f136119763b6",
          "tested_subject_digest": "9fcb0d747c9b2123212be7b1e5d812c9dff8568db6ea0cb0234549d44afa0e54",
          "scenario_contract_digest": "98415469dd74730e29a7bafa82cd8dafe016ea8247a6a0b78463a3437922b67a"
        }
      },
      "contract": {
        "path": "web/verification/browser-scenarios.json",
        "scenarioId": "LOGIN-SMOKE-V1",
        "scenarioDigest": "98415469dd74730e29a7bafa82cd8dafe016ea8247a6a0b78463a3437922b67a",
        "visualRuleId": "LOGIN-CARD-IN-VIEWPORT-V2",
        "visualRuleDigest": "4e67aaa77fb9649f2d665d036465be02dced712d0f8e98fb84ad3c2d554c4062"
      },
      "server": {
        "origin": "http://127.0.0.1:55861",
        "healthObservedByRunner": true
      },
      "route": "/login",
      "selectors": [
        {
          "key": "page",
          "testId": "shared-auth-login-page",
          "visible": true
        },
        {
          "key": "card",
          "testId": "shared-auth-login-card",
          "visible": true
        },
        {
          "key": "username",
          "testId": "shared-auth-login-username",
          "visible": true
        },
        {
          "key": "password",
          "testId": "shared-auth-login-password",
          "visible": true
        },
        {
          "key": "remember",
          "testId": "shared-auth-login-remember",
          "visible": true
        },
        {
          "key": "submit",
          "testId": "shared-auth-login-submit",
          "visible": true
        },
        {
          "key": "error",
          "testId": "shared-auth-login-error",
          "visible": true
        }
      ],
      "actions": [
        {
          "kind": "submit-empty",
          "target": "submit",
          "status": "PASS"
        },
        {
          "kind": "fill",
          "target": "username",
          "status": "PASS"
        },
        {
          "kind": "fill",
          "target": "password",
          "status": "PASS"
        },
        {
          "kind": "check",
          "target": "remember",
          "status": "PASS"
        },
        {
          "kind": "assert-checked",
          "target": "remember",
          "status": "PASS"
        },
        {
          "kind": "click",
          "target": "submit",
          "status": "PASS"
        },
        {
          "kind": "await-response",
          "target": "mapped-responder",
          "status": "PASS"
        },
        {
          "kind": "assert-visible",
          "target": "error",
          "status": "PASS"
        }
      ],
      "response": {
        "browserObserved": true,
        "method": "POST",
        "path": "/api/v1/console/auth/login",
        "status": 401,
        "contentType": "application/json",
        "marker": {
          "name": "X-YCS-Scenario",
          "value": "LOGIN-SMOKE-V1"
        },
        "body": {
          "code": "AUTH_INVALID_CREDENTIALS",
          "message": "用户名或密码错误"
        },
        "bodySha256": "f05401e30be56f48f3a98c6682f60ad72b9b1c25155e89d2a675b94282fc345e"
      },
      "uiError": {
        "testId": "shared-auth-login-error",
        "text": "用户名或密码错误，或账号已被锁定",
        "visible": true
      }
    },
    "artifacts": {
      "screenshot": {
        "locator": "embedded:screenshot",
        "mediaType": "image/png",